{
  "schema_version": "0.1",
  "archive_version": "0.1",
  "archive_type": "events",
  "archive_month": "2026-06",
  "last_modified_at": "2026-06-05T01:02:29+09:00",
  "timezone": "Asia/Seoul",
  "event_count": 91,
  "events": [
    {
      "event_id": "2026-06-04T20:09:36+09:00|added|pnu-main-notice:1508790|f23518c4179a",
      "event_type": "added",
      "notice_id": "pnu-main-notice:1508790",
      "source_id": "pnu-main-notice",
      "seen_at": "2026-06-04T20:09:36+09:00",
      "published_at": "2026-05-07",
      "title": "2026년 미 국무부 CLS 프로그램 룸메이트 2차 모집",
      "url": "https://www.pusan.ac.kr/kor/CMS/Board/PopupBoard.do?mgr_seq=3&mode=view&mgr_seq=3&board_seq=1508790",
      "content_hash": "f23518c4179ae8df14a464b69c92bc9ecd8cb31833add273607ccbb417bc8f3e",
      "previous_content_hash": null,
      "archive_notice_file": "../notices/2026-05.json",
      "archive_notice_id": "pnu-main-notice:1508790"
    },
    {
      "event_id": "2026-06-04T20:09:36+09:00|added|pnu-main-notice:1508999|6fdcf51e50a3",
      "event_type": "added",
      "notice_id": "pnu-main-notice:1508999",
      "source_id": "pnu-main-notice",
      "seen_at": "2026-06-04T20:09:36+09:00",
      "published_at": "2026-05-20",
      "title": "2026년 2학기 국가장학금 1차 신청 기간 안내",
      "url": "https://www.pusan.ac.kr/kor/CMS/Board/PopupBoard.do?mgr_seq=3&mode=view&mgr_seq=3&board_seq=1508999",
      "content_hash": "6fdcf51e50a300ee6d86e33b693b68c281e60eefed736ee1d5da240c8fb6752e",
      "previous_content_hash": null,
      "archive_notice_file": "../notices/2026-05.json",
      "archive_notice_id": "pnu-main-notice:1508999"
    },
    {
      "event_id": "2026-06-04T20:09:36+09:00|added|pnu-main-notice:1509022|803b2b41380e",
      "event_type": "added",
      "notice_id": "pnu-main-notice:1509022",
      "source_id": "pnu-main-notice",
      "seen_at": "2026-06-04T20:09:36+09:00",
      "published_at": "2026-05-21",
      "title": "[AX·정보화혁신본부] 「AI 창작 챌린지 공모전」 개최 안내",
      "url": "https://www.pusan.ac.kr/kor/CMS/Board/PopupBoard.do?mgr_seq=3&mode=view&mgr_seq=3&board_seq=1509022",
      "content_hash": "803b2b41380e8abe538c1d4a425305b55a51acbee287723b5fa18662798c78c3",
      "previous_content_hash": null,
      "archive_notice_file": "../notices/2026-05.json",
      "archive_notice_id": "pnu-main-notice:1509022"
    },
    {
      "event_id": "2026-06-04T20:09:36+09:00|added|pnu-main-notice:1509209|2ea4456e39bd",
      "event_type": "added",
      "notice_id": "pnu-main-notice:1509209",
      "source_id": "pnu-main-notice",
      "seen_at": "2026-06-04T20:09:36+09:00",
      "published_at": "2026-06-01",
      "title": "[효원상담원] (무료 블렌딩티 클래스 2차, 간식 제공) 예비교원을 위한 마음지킴 프로젝트 안내(6/26)",
      "url": "https://www.pusan.ac.kr/kor/CMS/Board/PopupBoard.do?mgr_seq=3&mode=view&mgr_seq=3&board_seq=1509209",
      "content_hash": "2ea4456e39bdcf66d878e12e2dd7c5ee6211d6a280556de83c66cd1be4c8df1d",
      "previous_content_hash": null,
      "archive_notice_file": "../notices/2026-06.json",
      "archive_notice_id": "pnu-main-notice:1509209"
    },
    {
      "event_id": "2026-06-04T20:09:36+09:00|added|pnu-main-notice:1509210|1acc37d82666",
      "event_type": "added",
      "notice_id": "pnu-main-notice:1509210",
      "source_id": "pnu-main-notice",
      "seen_at": "2026-06-04T20:09:36+09:00",
      "published_at": "2026-06-02",
      "title": "학생 마음건강 전수조사 참여 요청",
      "url": "https://www.pusan.ac.kr/kor/CMS/Board/PopupBoard.do?mgr_seq=3&mode=view&mgr_seq=3&board_seq=1509210",
      "content_hash": "1acc37d8266656074c2dad2428eb220c017b645700ef5972c085e78c28b1e587",
      "previous_content_hash": null,
      "archive_notice_file": "../notices/2026-06.json",
      "archive_notice_id": "pnu-main-notice:1509210"
    },
    {
      "event_id": "2026-06-04T20:09:36+09:00|added|pnu-main-notice:1509218|76b7d3565635",
      "event_type": "added",
      "notice_id": "pnu-main-notice:1509218",
      "source_id": "pnu-main-notice",
      "seen_at": "2026-06-04T20:09:36+09:00",
      "published_at": "2026-06-02",
      "title": "[교수학습지원센터] (밀양/양산) 원데이 학습컨설팅 안내(~6.12)",
      "url": "https://www.pusan.ac.kr/kor/CMS/Board/PopupBoard.do?mgr_seq=3&mode=view&mgr_seq=3&board_seq=1509218",
      "content_hash": "76b7d35656357974e3900d5dbee9e1806f7799be49b996197f37e5695217aa1b",
      "previous_content_hash": null,
      "archive_notice_file": "../notices/2026-06.json",
      "archive_notice_id": "pnu-main-notice:1509218"
    },
    {
      "event_id": "2026-06-04T20:09:36+09:00|added|pnu-main-notice:1509222|f07fea47049c",
      "event_type": "added",
      "notice_id": "pnu-main-notice:1509222",
      "source_id": "pnu-main-notice",
      "seen_at": "2026-06-04T20:09:36+09:00",
      "published_at": "2026-06-02",
      "title": "[재단법인 NSI] 2026년 청년 국가재정 마스터 5기 모집안내(~7/13)",
      "url": "https://www.pusan.ac.kr/kor/CMS/Board/PopupBoard.do?mgr_seq=3&mode=view&mgr_seq=3&board_seq=1509222",
      "content_hash": "f07fea47049cc0f6cac942fac457e032f894575f8cf98859aa0594c24880be66",
      "previous_content_hash": null,
      "archive_notice_file": "../notices/2026-06.json",
      "archive_notice_id": "pnu-main-notice:1509222"
    },
    {
      "event_id": "2026-06-04T20:09:36+09:00|added|pnu-main-notice:1509224|fa634c40cf97",
      "event_type": "added",
      "notice_id": "pnu-main-notice:1509224",
      "source_id": "pnu-main-notice",
      "seen_at": "2026-06-04T20:09:36+09:00",
      "published_at": "2026-06-02",
      "title": "[기술사업부] 2026년 상반기 지식재산권 6차 교육 운영 및 신청 안내(NT, ET분야 사례를 통한 특허 출원 전략)",
      "url": "https://www.pusan.ac.kr/kor/CMS/Board/PopupBoard.do?mgr_seq=3&mode=view&mgr_seq=3&board_seq=1509224",
      "content_hash": "fa634c40cf972e37ffb8321abe0ee2f8f0ce0731dc9eea8c343b7baf2d6e01e4",
      "previous_content_hash": null,
      "archive_notice_file": "../notices/2026-06.json",
      "archive_notice_id": "pnu-main-notice:1509224"
    },
    {
      "event_id": "2026-06-04T20:09:36+09:00|added|pnu-main-notice:1509229|fc143910848a",
      "event_type": "added",
      "notice_id": "pnu-main-notice:1509229",
      "source_id": "pnu-main-notice",
      "seen_at": "2026-06-04T20:09:36+09:00",
      "published_at": "2026-06-02",
      "title": "2026학년도 여름계절 및 도약수업 2차(최종) 폐강강좌 통보 및 수강정정 안내",
      "url": "https://www.pusan.ac.kr/kor/CMS/Board/PopupBoard.do?mgr_seq=3&mode=view&mgr_seq=3&board_seq=1509229",
      "content_hash": "fc143910848a286bd0f4d58fc97fe175b529481574309ca279e25c2417dc1033",
      "previous_content_hash": null,
      "archive_notice_file": "../notices/2026-06.json",
      "archive_notice_id": "pnu-main-notice:1509229"
    },
    {
      "event_id": "2026-06-04T20:09:36+09:00|added|pnu-main-notice:1509230|6ec1885c6e30",
      "event_type": "added",
      "notice_id": "pnu-main-notice:1509230",
      "source_id": "pnu-main-notice",
      "seen_at": "2026-06-04T20:09:36+09:00",
      "published_at": "2026-06-02",
      "title": "(재공지)[글로컬대학 30] 'DH 이해하기 II: AI 세상에 인문학 적용하기' 비교과 프로그램 운영 및 참가 신청 안내",
      "url": "https://www.pusan.ac.kr/kor/CMS/Board/PopupBoard.do?mgr_seq=3&mode=view&mgr_seq=3&board_seq=1509230",
      "content_hash": "6ec1885c6e30c705e976ccf868115a0e350deffd297ecb0b61e19b1b2267d78e",
      "previous_content_hash": null,
      "archive_notice_file": "../notices/2026-06.json",
      "archive_notice_id": "pnu-main-notice:1509230"
    },
    {
      "event_id": "2026-06-04T20:09:36+09:00|added|pnu-main-notice:1509231|0a6dbb438bc7",
      "event_type": "added",
      "notice_id": "pnu-main-notice:1509231",
      "source_id": "pnu-main-notice",
      "seen_at": "2026-06-04T20:09:36+09:00",
      "published_at": "2026-06-02",
      "title": "[부산시설공단] 제16기 글로벌 대학생 홍보단 「영비스코(Young BISCO)」 모집 안내",
      "url": "https://www.pusan.ac.kr/kor/CMS/Board/PopupBoard.do?mgr_seq=3&mode=view&mgr_seq=3&board_seq=1509231",
      "content_hash": "0a6dbb438bc70b8a0b9a2d0ce38093bd180a06f567634fa70169e218787ff70e",
      "previous_content_hash": null,
      "archive_notice_file": "../notices/2026-06.json",
      "archive_notice_id": "pnu-main-notice:1509231"
    },
    {
      "event_id": "2026-06-04T20:09:36+09:00|added|pnu-main-notice:1509232|4eade69aee29",
      "event_type": "added",
      "notice_id": "pnu-main-notice:1509232",
      "source_id": "pnu-main-notice",
      "seen_at": "2026-06-04T20:09:36+09:00",
      "published_at": "2026-06-02",
      "title": "[금융감독원] 제14기 「FSS 대학생 금융교육 봉사단」 모집 안내",
      "url": "https://www.pusan.ac.kr/kor/CMS/Board/PopupBoard.do?mgr_seq=3&mode=view&mgr_seq=3&board_seq=1509232",
      "content_hash": "4eade69aee29508e9dd177a5435cff4c642b7a35e5e80f78a2362420a4c751f1",
      "previous_content_hash": null,
      "archive_notice_file": "../notices/2026-06.json",
      "archive_notice_id": "pnu-main-notice:1509232"
    },
    {
      "event_id": "2026-06-04T20:09:36+09:00|added|pnu-main-notice:1509234|f723ac986b0b",
      "event_type": "added",
      "notice_id": "pnu-main-notice:1509234",
      "source_id": "pnu-main-notice",
      "seen_at": "2026-06-04T20:09:36+09:00",
      "published_at": "2026-06-02",
      "title": "2026학년도 여름 계절수업 및 도약수업 등록금 납부, 수강취소 안내",
      "url": "https://www.pusan.ac.kr/kor/CMS/Board/PopupBoard.do?mgr_seq=3&mode=view&mgr_seq=3&board_seq=1509234",
      "content_hash": "f723ac986b0b058bdea80f674116c1d407fbb79ddf31122db76f93d3f36db1c3",
      "previous_content_hash": null,
      "archive_notice_file": "../notices/2026-06.json",
      "archive_notice_id": "pnu-main-notice:1509234"
    },
    {
      "event_id": "2026-06-04T20:09:36+09:00|added|pnu-main-notice:1509243|b9baaa2dabfe",
      "event_type": "added",
      "notice_id": "pnu-main-notice:1509243",
      "source_id": "pnu-main-notice",
      "seen_at": "2026-06-04T20:09:36+09:00",
      "published_at": "2026-06-04",
      "title": "[효원상담원] 학기말을 의미있게 보낼 수 있는 심리기술훈련으로 여러분을 초대합니다.",
      "url": "https://www.pusan.ac.kr/kor/CMS/Board/PopupBoard.do?mgr_seq=3&mode=view&mgr_seq=3&board_seq=1509243",